id,organisation,records_lost,month,year,sector,method,data_sensitivity,story,source_name,city,country,latitude,longitude,coordinates,dSens_desc,date
302,California Department of Child Support Services,800000,Apr,2012,government,lost device,2,"California child support records were lost in transit during a ""disaster preparedness"" exercise.",Business Insider,Sacramento,USA,38.5816,-121.4944,"[38.5816, -121.4944]",SSN/Personal details,2012-04-01
303,Emory Healthcare,315000,Apr,2012,health,lost device,4,"The company 'misplaced' 10 backup discs containing sensitive patient information, including social security numbers. ",Emory,Atlanta,USA,33.749,-84.388,"[33.749, -84.388]",Health & other personal records,2012-04-01
304,Office of the Texas Attorney General,6500000,Apr,2012,government,accident,2,The office of Texas Attorney General Greg Abbott mistakenly gave attorneys access to a database containing millions of Social Security numbers.,Raw Story,Austin,USA,30.2672,-97.7431,"[30.2672, -97.7431]",SSN/Personal details,2012-04-01
306,Blizzard,14000000,Aug,2012,gaming,hacked,2,"Scrambled passwords, e-mail addresses, and personal security answers were stolen from Blizzard's internal network. Blizzard would not elaborate on the size of the hack (""millions""). ",Forbes,Irvine,USA,33.6846,-117.8265,"[33.6846, -117.8265]",SSN/Personal details,2012-08-01
307,New York State Electric & Gas,1800000,Jan,2012,misc,inside job,2,An employee from a software consulting firm was able to grant unauthorized access to the energy supplier's database.,Data Breaches,Binghamton,USA,42.0987,-75.918,"[42.0987, -75.918]",SSN/Personal details,2012-01-01
308,Memorial Healthcare System,102153,Apr,2012,health,lost device,2,"For more than a year, an employee of an affiliated physician’s office accessed patient information through a web portal: names, dates of birth and Social Security numbers.",Modern Healthcare,Hollywood,USA,34.0928,-118.3287,"[34.0928, -118.3287]",SSN/Personal details,2012-04-01
309,Zappos,24000000,Jan,2012,web,hacked,2,"The Amazon-owned e-commerce firm was the target of a cyber attack on its internal network, exposing names, e-mail addresses, phone numbers,addresses, and encrypted passwords.",Forbes,Las Vegas,USA,36.1699,-115.1398,"[36.1699, -115.1398]",SSN/Personal details,2012-01-01
311,KT Corp.,8700000,Jul,2012,telecoms,hacked,2,"Two suspects earned an estimated $877,000 by selling the contact information and plan details of 8.7 million subscribers to Korea's second largest mobile phone network.","Korea Times, CNet",Seoul,South Korea,37.5665,126.978,"[37.5665, 126.978]",SSN/Personal details,2012-07-01
313,Last.fm,43500000,Sep,2012,web,hacked,1,"Usernames, email addresses and other internal records, such as newsletter sign-ups and ad-related data, were stolen in a 2012 hack.",ZD Net,London,United Kingdom,51.5074,-0.1278,"[51.5074, -0.1278]",Just email address/online information,2012-09-01
314,"LinkedIn, eHarmony, Last.fm",8000000,Jun,2012,web,hacked,1,"Hacker 'dwdm' uploaded a file containing 6.5 million passwords to a Russian hacker forum. Soon after, another 1.5 million passwords were discovered in another file on the forum.",Cnet,Sunnyvale,USA,37.3688,-122.0363,"[37.3688, -122.0363]",Just email address/online information,2012-06-01
315,Gamigo,8000000,Jul,2012,web,hacked,1,"4 months after the gaming site Gamigo warned users about a hacker intrusion, more than 8 million usernames, emails & encrypted passwords from the site were published on the web.",Forbes,Hamburg,Germany,53.5511,9.9937,"[53.5511, 9.9937]",Just email address/online information,2012-07-01
318,Greek government,9000000,Nov,2012,government,hacked,2,A computer programmer was arrested in Greece for allegedly stealing the identity information of 83% of the country's population. The 35-year-old was suspected of trying to sell it on.,Wired,Athens,Greece,37.9838,23.7275,"[37.9838, 23.7275]",SSN/Personal details,2012-11-01
319,South Carolina State Dept. of Revenue,3600000,Oct,2012,government,hacked,1,A server containing social security numbers and credit card data was breached by an international hacker.,Information Week,Columbia,USA,34.0007,-81.0348,"[34.0007, -81.0348]",Just email address/online information,2012-10-01
320,Dropbox,68700000,Aug,2012,web,hacked,1,"User credentials were stolen in a 2012 hack, but the number affected only came to light four years later. Dropbox reset any passwords that had been unchanged since 2012.",The Telegraph,San Francisco,USA,37.7749,-122.4194,"[37.7749, -122.4194]",Just email address/online information,2012-08-01
321,New York City Health & Hospitals Corp.,1700000,Feb,2011,health,lost device,4,Computer backup tapes from the New York provider were stolen from a truck that was transporting them to a secure storage location. ,InfoRisk,New York City,USA,40.7128,-74.006,"[40.7128, -74.006]",Health & other personal records,2011-02-01
322,"Seacoast Radiology, PA",231400,Jan,2011,health,hacked,2,"Computer gamers hacked a server in search of more bandwidth to play Call of Duty. In the process they  gained access to personal records of more than 230,000 patients.",Fosters,New Hampshire,USA,43.1939,-71.5724,"[43.1939, -71.5724]",SSN/Personal details,2011-01-01
323,"South Shore Hospital, Massachusetts",800000,Sep,2011,health,lost device,5,"South Shore Hospital hired a contractor to destroy files no longer in use. The firm lost the shipment. It contained social security numbers, medical records and banking details.",Boston Globe,South Weymouth,USA,42.2209,-70.941,"[42.2209, -70.941]",Full details,2011-09-01
324,Betfair,2300000,May,2011,web,hacked,3,"Betfair waited 18 months to report the breach of their online gambling site, alarming banking institutions and security experts. The breach involved user names, addresses and account details.",FT,London,United Kingdom,51.5074,-0.1278,"[51.5074, -0.1278]",Credit card information,2011-05-01
325,"Ankle & foot Center of Tampa Bay, Inc.",156000,Jan,2011,health,hacked,4,"Names, social security numbers, date of birth, home addressees, account numbers, healthcare services and diagnostics were hacked.",Phi Privacy,Tampa,USA,27.9506,-82.4572,"[27.9506, -82.4572]",Health & other personal records,2011-01-01
326,Yale University,43000,Aug,2011,academic,accident,2,"The names and Social Security numbers of 43,000 people affiliated with the university were publicly viewable on Google for 10 months.",NBC News,New Haven,USA,41.3082,-72.9282,"[41.3082, -72.9282]",SSN/Personal details,2011-08-01
327,Morgan Stanley Smith Barney,34000,Jul,2011,financial,lost device,3,"Morgan Stanley mailed two CDRs containing sensitive data about investors to the New York State Department of Taxation and Finance. When it arrived at the relevant desk, the CDs were missing.",ABC News,New York City,USA,40.7128,-74.006,"[40.7128, -74.006]",Credit card information,2011-07-01
329,Epsilon,3000000,Apr,2011,web,hacked,1,"Names & email addresses of customers of Barclaycard US, Capital One, JP Morgan, Citigroup & other firms were stolen via a breach in an email system.  ",Guardian,Irving,USA,32.814,-96.9489,"[32.814, -96.9489]",Just email address/online information,2011-04-01
330,Sony PSN,77000000,Apr,2011,gaming,hacked,1,"Rounding off a thoroughly unhappy year for Sony, their third breach saw a breach of 76,000,000 Sony PSN and Qriocity user accounts. They were offline for 23 days.",Mashable,San Mateo,USA,37.5537,-122.2654,"[37.5537, -122.2654]",Just email address/online information,2011-04-01
332,University of Wisconsin - Milwaukee,73000,Aug,2011,academic,hacked,2,"A malware attack on a database server exposed the names and social security numbers of students and staff, past and present. ",ZDNet,Milwaukee,USA,43.0389,-87.9065,"[43.0389, -87.9065]",SSN/Personal details,2011-08-01
337,Bethesda Game Studios,200000,Jun,2011,gaming,hacked,1,"Hacking collective Lulzsec claimed to have stolen the account information of 200,000 users.",PC World,Rockville,USA,39.0834,-77.1558,"[39.0834, -77.1558]",Just email address/online information,2011-06-01
338,Sega,1290755,Jun,2011,gaming,hacked,2,"Information registered as part of the Sega Pass system was stolen, including names, birth dates, e-mail addresses and passwords.",ZDNet,Tokyo,Japan,35.682839,139.759455,"[35.682839, 139.759455]",SSN/Personal details,2011-06-01
342,Washington Post,1270000,Jul,2011,misc,hacked,2,"Unknown hackers broke into The Washington Post's jobs website, stealing user IDs and email addresses.",PC Mag,Washington,USA,38.8951,-77.0369,"[38.8951, -77.0369]",SSN/Personal details,2011-07-01
343,Health Net - IBM,1900000,Mar,2011,health,lost device,3,As many as nine server drives containing personal information of former and current employees went missing from an IBM data center in California.,IEEE Spectrum,Los Angeles,USA,34.0522,-118.2437,"[34.0522, -118.2437]",Credit card information,2011-03-01
344,Eisenhower Medical Center,514330,Apr,2011,health,lost device,4,"A computer stolen from the hospital contained patients' names, ages, dates of birth, medical record numbers and the last four digits of their social security numbers.",Data Breach Info,Rancho Mirage,USA,33.7385,-116.4084,"[33.7385, -116.4084]",Health & other personal records,2011-04-01
345,Spartanburg Regional Healthcare System,400000,May,2011,health,lost device,4,"A computer stolen from an employee's car contained a password-protected file with Social Security numbers as well as names, addresses, dates of birth and medical billing codes.",GoUpstate,Spartanburg,USA,34.9496,-81.932,"[34.9496, -81.932]",Health & other personal records,2011-05-01
346,NHS,8600000,Jun,2011,health,lost device,4,A laptop holding the unencrypted records of eight million patients went missing from an NHS store room and wasn't reported until 3 weeks later. ,Alphr,London,United Kingdom,51.5074,-0.1278,"[51.5074, -0.1278]",Health & other personal records,2011-06-01
348,Sony Online Entertainment,24600000,May,2011,gaming,hacked,3,"Hackers may have taken personal information from accounts in Austria, Germany, The Netherlands and Spain, including over 12,000 credit card accounts and 10,000 bank accounts.",Computer Weekly,San Diego,USA,32.7157,-117.1611,"[32.7157, -117.1611]",Credit card information,2011-05-01
349,Honda Canada,283000,May,2011,retail,hacked,2,"Names, addresses and vehicle identification numbers were taken from two of the firms' eCommerce websites, myHonda and myAcura",Guelph Mercury,Markham,Canada,43.8561,-79.337,"[43.8561, -79.337]",SSN/Personal details,2011-05-01
351,Oregon Department of Motor Vehicles,1000000,May,2011,government,hacked,2,"Detectives arrested Tim Nuss for accessing an old Oregon Department of Motor Vehicles database, including names, addresses, birth dates, gender and ages of people who registered.",Data Breaches,Salem,USA,44.9429,-123.0351,"[44.9429, -123.0351]",SSN/Personal details,2011-05-01
352,Steam,35000000,Nov,2011,web,hacked,3,"Attackers used login details from a forum hack to gain access to a database containing user names, encrypted passwords and credit card info, game purchases and billing addresses.",SC Mag,Bellevue,USA,47.6101,-122.2015,"[47.6101, -122.2015]",Credit card information,2011-11-01
353,Restaurant Depot,200000,Nov,2011,retail,hacked,3,Nov 2011. Cybercrooks presumed to be operating from Russia hacked into the Restaurant Depot database and accessed credit and debit card details.,NBC News,College Point,USA,40.7862,-73.8454,"[40.7862, -73.8454]",Credit card information,2011-11-01
354,Nexon Korea Corp,13200000,Nov,2011,web,hacked,2,Personal data of subscribers to the online game Maple Story was breached and subsequently leaked.,Reuters,Seoul,South Korea,37.5665,126.978,"[37.5665, 126.978]",SSN/Personal details,2011-11-01
355,Nemours Foundation,1600000,Oct,2011,health,lost device,4,"A Florida health care provider responsible for running children’s hospitals lost three data backup tapes, containing 10 years worth of information.",Law360,Jacksonville,USA,30.3322,-81.6557,"[30.3322, -81.6557]",Health & other personal records,2011-10-01
356,Sutter Medical Foundation,4243434,Nov,2011,health,lost device,2,"A stolen laptop contained a database with names, addresses, dates of birth, phone numbers, email addresses, medical record numbers and health insurance plans.",Trend Micro,Sacramento,USA,38.5816,-121.4944,"[38.5816, -121.4944]",SSN/Personal details,2011-11-01
358,"AvMed, Inc.",1220000,Feb,2010,health,lost device,2,"Two company laptops containing names, addresses, dates of birth, Social Security numbers and health-related information were stolen from an AvMed facility in Gainesville.",Hack Notice,Miami,USA,25.7617,-80.1918,"[25.7617, -80.1918]",SSN/Personal details,2010-02-01
359,Blue Cross Blue Shield of Tennessee,1023209,May,2010,health,lost device,2,A thief stole 57 unencrypted hard drives from the closet of a BlueCross call center in Chattanooga.,Data Breaches,Chattanooga,USA,35.0456,-85.3097,"[35.0456, -85.3097]",SSN/Personal details,2010-05-01
362,"Triple-S Salud, Inc.",398000,Nov,2010,health,lost device,4,"A competitor accessed restricted areas of the healthcare firm's website without authorisation, compromising client information.",Data Breaches,San Juan,Puerto Rico,18.4655,-66.1057,"[18.4655, -66.1057]",Health & other personal records,2010-11-01
363,Ohio State University,760000,Dec,2010,academic,hacked,2,"The breach affected current and former students. It cost the university $4m in expenses related to investigative consulting, breach notification and credit security. ",The Lantern,Columbus,USA,39.9612,-82.9988,"[39.9612, -82.9988]",SSN/Personal details,2010-12-01
364,"Emergency Healthcare Physicians, Ltd.",180111,May,2010,health,lost device,4,"A stolen portable hard drive contained records from 2003 to 2006, including patient names, addressees, phone numbers, birth dates and Social Security numbers.",Healthcare Info Security,Lafayette,USA,30.2241,-92.0198,"[30.2241, -92.0198]",Health & other personal records,2010-05-01
366,AT&T,114000,Jun,2010,telecoms,hacked,1,"Details of iPad 3G users, thought to include those of White House chief of staff Rahm Emanuel, was stolen from the AT&T website.",Guardian,Dallas,USA,32.7767,-96.797,"[32.7767, -96.797]",Just email address/online information,2010-06-01
389,AT&T,113000,Jun,2008,telecoms,lost device,1,A laptop containing unencrypted Social Security numbers and bonus/salary info of AT&T employees was stolen from a car.,NetworkWorld,Dallas,USA,32.7767,-96.797,"[32.7767, -96.797]",Just email address/online information,2008-06-01
367,Lincoln Medical & Mental Health Center,130495,Jun,2010,health,lost device,4,Protected health information was exposed after seven CDs were lost in transit with FedEx.,Alert Boot,Bronx,USA,40.8448,-73.8648,"[40.8448, -73.8648]",Health & other personal records,2010-06-01
368,Educational Credit Management Corp,3300000,Mar,2010,financial,lost device,2,A contractor for the US Department of Education stole a device containing student loan records. The breach affected as many as 5% of all the country's federal student loan borrowers.,Wall Street Journal,Minneapolis,USA,44.9778,-93.265,"[44.9778, -93.265]",SSN/Personal details,2010-03-01
369,US Federal Reserve Bank of Cleveland,400000,Nov,2010,financial,hacked,3,"Nov 2010. A Malaysian man was charged with hacking into major US corporations and stealing 400,000 credit and debit card account numbers.",Bank Info Security,Cleveland,USA,41.4993,-81.6944,"[41.4993, -81.6944]",Credit card information,2010-11-01
371,Heartland,130000000,Jan,2009,financial,hacked,3,"Keylogging malware caused a massive data breach. Heartland eventually paid more than $110 million to Visa, MasterCard, American Express and other card associations to settle claims.",Dark Reading,Princeton,USA,40.3573,-74.6672,"[40.3573, -74.6672]",Credit card information,2009-01-01
373,RockYou!,32000000,Dec,2009,web,hacked,1,The site did not allow users to use special characters or punctuation in their passwords and e-mailed user passwords in plain text. Hackers took advantage of these security lapses.,Tech Crunch,San Francisco,USA,37.7749,-122.4194,"[37.7749, -122.4194]",Just email address/online information,2009-12-01
374,CheckFree Corporation,5000000,Jan,2009,financial,hacked,1,Criminals took control of the payment service's domains. They redirected traffic to a Ukrainian Web server that used malware to install a password-stealing program on the victim's computer.,Computer World,Norcross,USA,33.9412,-84.2135,"[33.9412, -84.2135]",Just email address/online information,2009-01-01
375,Network Solutions,573000,Jul,2009,web,hacked,3,A large-scale infection of e-commerce sites with malicious code led to the compromise of thousands of debit and credit cards.,Washington Post,Jacksonville,USA,30.3322,-81.6557,"[30.3322, -81.6557]",Credit card information,2009-07-01
376,Virginia Prescription Monitoring Program,531400,May,2009,health,hacked,2,A prescriptions website with a database containing 8m patient records and 35m prescription records was hacked. The hacker demanded a $10 million ransom for the breach.,Digital Health,Richmond,USA,37.5407,-77.436,"[37.5407, -77.436]",SSN/Personal details,2009-05-01
377,University of California Berkeley,160000,May,2009,academic,hacked,3,The attackers accessed a computer belonging to the university's health centre. The personal information of current students and alumni was stolen.,Cnet,Berkeley,USA,37.8715,-122.273,"[37.8715, -122.273]",Credit card information,2009-05-01
380,Compass Bank,1000000,Mar,2008,financial,inside job,3,"A former employee stole a hard drive containing 1m account details between May & July 2007, then used it to defraud cutomers of nearly $32,000.",Computer Weekly,Birmingham,USA,33.5207,-86.8025,"[33.5207, -86.8025]",Credit card information,2008-03-01
381,Hannaford Brothers Supermarket Chain,4200000,Mar,2008,retail,hacked,3,An estimated 4.2 million credit and debit card numbers were stolen when payment data was intercepted by hackers.,NetworkWorld,Scarborough,USA,43.6777,-70.3573,"[43.6777, -70.3573]",Credit card information,2008-03-01
382,University of Miami,2100000,Apr,2008,academic,lost device,3,Six backup tapes from the medical school containing more than 2 million medical records were stolen from a van that was transporting the data to an off-site facility.,Identity Theft,Coral Gables,USA,25.7215,-80.2684,"[25.7215, -80.2684]",Credit card information,2008-04-01
383,BNY Mellon Shareowner Services,4500000,May,2008,financial,lost device,1,An archiving vendor lost a box full of data storage tapes containing sensitive information.,Reuters,New York City,USA,40.7128,-74.006,"[40.7128, -74.006]",Just email address/online information,2008-05-01
384,Countrywide Financial Corp,2500000,Aug,2008,financial,inside job,2,A senior financial analyst was sentenced to eight months in prison after pleading guilty to downloading millions of borrower files onto thumb drives & selling the information.,LATimes,Calabasas,USA,34.1367,-118.6615,"[34.1367, -118.6615]",SSN/Personal details,2008-08-01
385,UK Home Office,84000,Aug,2008,government,lost device,2,"PA Consulting lost an unencrypted memory stick containing details of high risk, prolific and other offenders. It had its contract terminated after an enquiry.",Wikipedia,London,United Kingdom,51.5074,-0.1278,"[51.5074, -0.1278]",SSN/Personal details,2008-08-01
386,RBS Worldpay,1500000,Dec,2008,financial,hacked,5,A hack compromised RBS Worldpay prepay and gift cards. Actual fraud has been committed on approximately 100 cards. The personal information of over 1m people was exposed.,The Register,Atlanta,USA,33.749,-84.388,"[33.749, -84.388]",Full details,2008-12-01
387,Auction.co.kr,18000000,Feb,2008,web,hacked,3,South Korea’s largest online shopping site was attacked by a Chinese hacker who made off with user information and a large amount of financial data.,Dark Reading,Seoul,South Korea,37.5665,126.978,"[37.5665, 126.978]",Credit card information,2008-02-01
388,GS Caltex,11100000,Sep,2008,misc,inside job,2,Two multimedia discs containing personal data of Korean customers was found by an office worker in a trash pile in Seoul. Likely to have been stolen by an employee.,The Dong-a Ilbo,Seoul,South Korea,37.5665,126.978,"[37.5665, 126.978]",SSN/Personal details,2008-09-01
390,Stanford University,72000,Jun,2008,academic,lost device,2,A laptop containing information on tens of thousands of past and current Stanford University employees was stolen.,SFGate,Stanford,USA,37.4241,-122.1661,"[37.4241, -122.1661]",SSN/Personal details,2008-06-01
391,University of Utah Hospitals & Clinics,2200000,Jun,2008,academic,lost device,4,Petty thieves stole backup data tapes containing billing records from an employee's car. According to police reports the thieves tried - and failed - to view the tapes using a VHS player.,Salt Lake Tribune,Salt Lake City,USA,40.7608,-111.891,"[40.7608, -111.891]",Health & other personal records,2008-06-01
392,Chile Ministry Of Education,6000000,May,2008,government,hacked,1,A computer hacker in Chile published confidential records belonging to six million people to illustrate the weakness of government security. ,BBC News,Santiago,Chile,-33.4489,-70.6693,"[-33.4489, -70.6693]",Just email address/online information,2008-05-01
393,Texas Lottery,89000,Nov,2008,government,inside job,2,"Data on more than 89,000 lottery winners (including names, Social Security numbers, addresses and prize amounts) were taken from the agency without permission by a former employee.",Houston Chronicle,Austin,USA,30.2672,-97.7431,"[30.2672, -97.7431]",SSN/Personal details,2008-11-01
394,Starbucks,97000,Nov,2008,retail,lost device,2,"A laptop containing private information on 97,000 employees was stolen. Employees won a case against the firm before losing in the federal court as they were unable to prove any cognizable harm.",Info Watch,Seattle,USA,47.6062,-122.3321,"[47.6062, -122.3321]",SSN/Personal details,2008-11-01
395,UK Ministry of Defence,1700000,Oct,2008,government,lost device,5,"A hard drive containing sensitive details of Armed Forces personnel - passport & national insurance numbers, bank details etc - went missing. The loss was revealed during National Identity Fraud Prevention Week. ",BBC News,London,United Kingdom,51.5074,-0.1278,"[51.5074, -0.1278]",Full details,2008-10-01
396,"T-Mobile, Deutsche Telecom",17000000,Oct,2008,telecoms,lost device,1,"Thieves stole a device containing names, addresses, cell phone numbers, and some birth dates and e-mail addresses for high-profile German citizens.",FT,Bonn,Germany,50.7374,7.0982,"[50.7374, 7.0982]",Just email address/online information,2008-10-01
397,Norwegian Tax Authorities,3950000,Sep,2008,government,accident,2,"Tax authorities accidentally sent CD-ROMs filled with the 2006 tax returns of 4m Norwegian citizens to editorial staff at national newspapers, radios and television stations.",Info Watch,Oslo,Norway,59.9139,10.7522,"[59.9139, 10.7522]",SSN/Personal details,2008-09-01
398,Service Personnel and Veterans Agency (UK),50500,Sep,2008,government,lost device,2,Hard drives containing personal information of employees were stolen from a high-security facility.,BBC News,United Kingdom,United Kingdom,55.3781,-3.436,"[55.3781, -3.436]",SSN/Personal details,2008-09-01
399,Monster.com,1600000,Aug,2007,web,hacked,2,"A trojan virus harvested user names, e-mail addresses, home addresses and phone numbers. Soon after, phishing e-mails encouraged users to download a Monster Job Seeker Tool, which was in fact malware.",BBC News,Weston,USA,26.1004,-80.3998,"[26.1004, -80.3998]",SSN/Personal details,2007-08-01
400,Driving Standards Agency,3000000,Dec,2007,government,lost device,2,"A hard disk with details of UK driving theory test candidates was lost by a contractor while they were in Iowa, USA.",BBC News,Bristol,United Kingdom,51.4545,-2.5879,"[51.4545, -2.5879]",SSN/Personal details,2007-12-01
401,Fidelity National Information Services,8500000,Jul,2007,financial,inside job,3,"An employee sold customer information to a data broker, including names, addresses, birth dates, bank account and credit card information.",PCWorld,Jacksonville,USA,30.3322,-81.6557,"[30.3322, -81.6557]",Credit card information,2007-07-01
402,City and Hackney Teaching Primary Care Trust,160000,Dec,2007,government,lost device,2,Disks containing children's personal details were lost by couriers. It prompted the agency to introduce disk encryption.,Computer Weekly,London,United Kingdom,51.5074,-0.1278,"[51.5074, -0.1278]",SSN/Personal details,2007-12-01
403,Gap Inc,800000,Sep,2007,retail,lost device,2,A laptop containing data on people who applied for positions at Gap stores between July 2006 and June 2007 was stolen.,PC World,San Francisco,USA,37.7749,-122.4194,"[37.7749, -122.4194]",SSN/Personal details,2007-09-01
404,Dai Nippon Printing,8637405,Mar,2007,retail,inside job,1,A former contractor of the firm stole 8.6 million records containing the personal data of customers.,Compare Business Products,Tokyo,Japan,35.682839,139.759455,"[35.682839, 139.759455]",Just email address/online information,2007-03-01
405,TK / TJ Maxx,94000000,Mar,2007,retail,hacked,3,A Minnesota store wifi network was hacked. Data from the credit and debit cards of shoppers  was stolen. ,ZD Net,Framingham,USA,42.2793,-71.4162,"[42.2793, -71.4162]",Credit card information,2007-03-01
407,UK Revenue & Customs,25000000,Nov,2007,government,lost device,1,A set of discs containing confidential details of 25 million child benefit recipients was lost.,BBC News,London,United Kingdom,51.5074,-0.1278,"[51.5074, -0.1278]",Just email address/online information,2007-11-01
408,TD Ameritrade,6300000,Sep,2007,financial,hacked,1,The firm settled a class action lawsuit to compensate as many as 6.3 million customers whose data was stolen by hackers.,"Wired, CBNC",Omaha,USA,41.2565,-95.9345,"[41.2565, -95.9345]",Just email address/online information,2007-09-01
