id,organisation,records_lost,month,year,sector,method,data_sensitivity,story,source_name,city,country,latitude,longitude,coordinates,dSens_desc,date
203,World Check,2200000,Jun,2016,misc,poor security,3,A database of suspected terrorists and criminals used by global banks and intelligence agencies was leaked online. Access is normally granted via a strict vetting process.,The Stack,London,United Kingdom,51.5074,-0.1278,"[51.5074, -0.1278]",Credit card information,2016-06-01
204,Mutuelle Generale de la Police,112000,Jun,2016,health,inside job,5,Personal details of French police officers were uploaded to Google Drive by an employee. The leak came two weeks after a gendarme was murdered in an ISIS-inspired attack.,BBC News,Paris,France,48.8566,2.3522,"[48.8566, 2.3522]",Full details,2016-06-01
205,VK,171000000,Jun,2016,web,hacked,4,"A database stolen in 2013 from the Russian social network, containing full names, email addresses and passwords, was offered for sale online.",Motherboard,Saint Petersburg,Russia,59.9343,30.3351,"[59.9343, 30.3351]",Health & other personal records,2016-06-01
206,KM.ru & Nival,1500000,Mar,2016,web,hacked,4,A hacker targeted several Russian websites in revenge for the shooting down of flight MH17 over Ukraine. They included videogame firm Nival and email provider KM.ru.,Motherboard,Moscow,Russia,55.7558,37.6176,"[55.7558, 37.6176]",Health & other personal records,2016-03-01
207,Fling,40000000,May,2016,web,hacked,4,"Data allegedly stolen in 2011 was put up for sale on the dark web. The stash included email addresses, plain text passwords and information on sexual desires & preferences.",IBTimes,London,United Kingdom,51.5074,-0.1278,"[51.5074, -0.1278]",Health & other personal records,2016-05-01
208,MySpace,164000000,May,2016,web,hacked,1,"In one of the largest password breaches ever, 360 million MySpace logins were stolen and put on sale for $2,800.",Vice,Beverly Hills,USA,34.0696,-118.4058,"[34.0696, -118.4058]",Just email address/online information,2016-05-01
209,Three,130000,Nov,2016,telecoms,hacked,2,Fraudsters compromised the mobile network's handset upgrade system and ordered new handsets to sell online. Customer details were accessed as part of the breach.,Three,Maidenhead,United Kingdom,51.522,-0.72,"[51.522, -0.72]",SSN/Personal details,2016-11-01
210,Red Cross Blood Service,550000,Oct,2016,health,accident,4,"Australian donor information was accessed via an unsecured database posted online by a contractor. Information included that of ""at-risk sexual behaviour"".",ABC News,Melbourne,Australia,-37.8136,144.9631,"[-37.8136, 144.9631]",Health & other personal records,2016-10-01
212,Dailymotion,85200000,Dec,2016,web,hacked,1,Users of the video sharing site had their email addresses and usernames stolen. One in five also had their passwords compromised.,ZDNet,Paris,France,48.8566,2.3522,"[48.8566, 2.3522]",Just email address/online information,2016-12-01
213,Weebly,43000000,Oct,2016,web,hacked,4,"IP addresses, usernames and hashed passwords were stolen from the web design platform.",Tech Crunch,San Francisco,USA,37.7749,-122.4194,"[37.7749, -122.4194]",Health & other personal records,2016-10-01
214,Interpark,10000000,Jul,2016,web,hacked,2,South Korean police blamed North Korea for stealing personal customer data from a shopping mall's server in an attempt to obtain foreign currency. ,NY times,Seoul,South Korea,37.5665,126.978,"[37.5665, 126.978]",SSN/Personal details,2016-07-01
216,Friend Finder Network,412000000,Nov,2016,web,hacked,1,"Almost every password used on Adult Friend Finder, Cams.com and Penthouse.com was breached. Those passwords were encrypted, but easily crackable.",ZDNet,Campbell,USA,37.2872,-121.949,"[37.2872, -121.949]",Just email address/online information,2016-11-01
217,Brazzers,790724,Sep,2016,web,hacked,4,"A vulnerability in the pornsite's forum software compromised millions of accounts, many of which had identical login details for the site itself.",Vice,Luxembourg,Luxembourg,49.6116,6.1319,"[49.6116, 6.1319]",Health & other personal records,2016-09-01
218,ClixSense,6600000,Sep,2016,web,hacked,5,"A service which pays people to view adverts and take surveys was hacked. Stolen information included addresses, banking details and social security numbers.",Digital trends,Yuba City,USA,39.1404,-121.6169,"[39.1404, -121.6169]",Full details,2016-09-01
219,Carefirst,1100000,May,2015,health,hacked,1,"Hackers gained access to a database belonging to the healthcare insurer, stealing names, birth dates, email addresses and insurance ID numbers.",Krebs on Security,Baltimore,USA,39.2904,-76.6122,"[39.2904, -76.6122]",Just email address/online information,2015-05-01
221,Premera,11000000,Mar,2015,health,hacked,5,"The health insurance firm revealed that its IT systems had been breached, exposing financial and medical records.",Computer Weekly,Mountlake Terrace,USA,47.7915,-122.3076,"[47.7915, -122.3076]",Full details,2015-03-01
223,Deep Root Analytics,198000000,Dec,2015,web,poor security,2,"A insecure database containing US voter information was discovered by a researcher. It contained names, addresses, contact details and party affiliations.","Reuters, UpGuard",Washington,USA,38.8951,-77.0369,"[38.8951, -77.0369]",SSN/Personal details,2015-12-01
225,Invest Bank,40000,Dec,2015,financial,hacked,4,"A hacker breached the systems of a UAE bank. They demanded a ransom of $3m in bitcoin to stop tweeting data, relating mainly to corporate accounts.",Daily Dot ,Sharjah,United Arab Emirates,25.3463,55.4209,"[25.3463, 55.4209]",Health & other personal records,2015-12-01
226,Sanrio,3300000,Dec,2015,web,poor security,2,"A researcher accessed a database containing login information, password hints and birthdates of fans of the Hello Kitty brand, including many children.",CSO Online,Tokyo,Japan,35.682839,139.759455,"[35.682839, 139.759455]",SSN/Personal details,2015-12-01
227,VTech,6400000,Dec,2015,web,hacked,5,"The toy maker was targeted by a hacker who stole the private data of millions of children, including names, email addresses and birth dates.",The Guardian,Hong Kong,Hong Kong,22.3193,114.1694,"[22.3193, 114.1694]",Full details,2015-12-01
228,Hacking Team,500000,Jul,2015,web,hacked,5,"An Italian hacking firm which sells digital surveillance software to national security organisations – including those of repressive regimes – was itself hacked, and the data put on BitTorrent.",The Guardian,Milan,Italy,45.4642,9.19,"[45.4642, 9.19]",Full details,2015-07-01
229,AshleyMadison.com,37000000,Jul,2015,web,hacked,1,The online hookup site for extra-marital affairs was severely breached. Personal details and company financial records were threatened with release.,Krebs on Security,Toronto,Canada,43.65107,-79.347015,"[43.65107, -79.347015]",Just email address/online information,2015-07-01
230,US Office of Personnel Management (2nd Breach),21500000,Jul,2015,government,hacked,5,"Hackers with suspected links to China accessed sensitive data on US intelligence and military personnel, leading to concerns about potential blackmail attempts.",BBC News,Washington,USA,38.8951,-77.0369,"[38.8951, -77.0369]",Full details,2015-07-01
231,US Office of Personnel Management,4000000,Jun,2015,government,hacked,2,"Hackers gained access to federal employees’ Social Security numbers, job assignments, performance ratings and training information.",Washington Post,Washington,USA,38.8951,-77.0369,"[38.8951, -77.0369]",SSN/Personal details,2015-06-01
232,Australian Immigration Department,30,Mar,2015,government,accident,4,An agency employee inadvertently sent the passport numbers and visa details of all world leaders attending the G20 Brisbane summit to the organisers of the Asian Cup football tournament.,The Guardian,Canberra,Australia,-35.2809,149.13,"[-35.2809, 149.13]",Health & other personal records,2015-03-01
233,IRS,100000,May,2015,government,hacked,1,"An organized crime syndicate used the IRS website to steal taxpayers' personal financial information. 15,000 of them were used to claim refunds in other people's names.",CNN,Washington,USA,38.8951,-77.0369,"[38.8951, -77.0369]",Just email address/online information,2015-05-01
234,MSpy,400000,May,2015,app,hacked,2,"A service that claims to help people spy on mobile devices was hacked, exposing emails, text messages, payment and location data.",Krebs on Security,London,United Kingdom,51.5074,-0.1278,"[51.5074, -0.1278]",SSN/Personal details,2015-05-01
236,Securus Technologies,70000000,Nov,2015,web,hacked,5,"An anonymous hacker leaked records of over 70m prisoner phone calls, plus links to recordings, potentially violating constitutional protections.",The Intercept,Carrollton,USA,32.9756,-96.8892,"[32.9756, -96.8892]",Full details,2015-11-01
237,TalkTalk,157000,Nov,2015,telecoms,hacked,2,"Shares in the telecoms firm plunged by a third after the hack, which exposed the banking details of more than 15,000 people.",BBC News,London,United Kingdom,51.5074,-0.1278,"[51.5074, -0.1278]",SSN/Personal details,2015-11-01
238,Experian / T-mobile,15000000,Oct,2015,telecoms,hacked,3,The world's biggest data monitoring firm disclosed a massive data breach. It had exposed the details of T-Mobile customers applying for credit checks.,Reuters,Costa Mesa,USA,33.6638,-117.9032,"[33.6638, -117.9032]",Credit card information,2015-10-01
239,Slack,500000,Mar,2015,app,hacked,1,"Sometime in February 2015, hackers were able to peruse Slack’s central database for up to four days. That database included usernames, email addresses and encrypted passwords.",Tech Crunch,San Francisco,USA,37.7749,-122.4194,"[37.7749, -122.4194]",Just email address/online information,2015-03-01
240,CarPhone Warehouse,2400000,Aug,2015,telecoms,hacked,3,"The breach exposed names, addresses, birth date and bank details. Around 480,000 were TalkTalk Mobile customers; 1.9m were customers of Carphone Warehouse directly.",The Guardian,London,United Kingdom,51.5074,-0.1278,"[51.5074, -0.1278]",Credit card information,2015-08-01
243,UCLA Health,4500000,May,2015,health,hacked,4,"Patient information was exposed in a hack on the network. In 2019, the firm reached a $2 million class-action lawsuit settlement.",Health IT Security,Los Angeles,USA,34.0522,-118.2437,"[34.0522, -118.2437]",Health & other personal records,2015-05-01
245,AOL,2400000,Apr,2014,web,hacked,1,User accounts were compromised in order to send out spam messages.,NBC News,New York City,USA,40.7128,-74.006,"[40.7128, -74.006]",Just email address/online information,2014-04-01
409,AOL,20000000,Aug,2006,web,accident,1,"AOL released search data for roughly 20 million web queries from 658,000 anonymized users of the service. No one is quite sure why.",Tech Crunch,New York City,USA,40.7128,-74.006,"[40.7128, -74.006]",Just email address/online information,2006-08-01
417,AOL,92000000,Jun,2004,web,inside job,1,A former America Online software engineer stole 92 million screen names and e-mail addresses and sold them to spammers who sent out up to 7 billion unsolicited e-mails.,CNN,New York City,USA,40.7128,-74.006,"[40.7128, -74.006]",Just email address/online information,2004-06-01
246,Community Health Systems,4500000,Aug,2014,health,hacked,2,"The US hospital operator suffered a system breach, leaking 5 years worth of data. Details included names, addresses, social security numbers. The goal: identity theft.",CNN,Franklin,USA,35.9251,-86.8689,"[35.9251, -86.8689]",SSN/Personal details,2014-08-01
247,Privatization Agency of the Republic of Serbia,5190396,Dec,2014,government,accident,2,A text file containing personal data and financial documents relating to almost all adult Serbian citizens was made publically available.,Poverenik,Belgrade,Serbia,44.7866,20.4489,"[44.7866, 20.4489]",SSN/Personal details,2014-12-01
248,Sony Pictures,10000000,Dec,2014,misc,hacked,2,"Potentially every piece of data held by the company was hacked, including unreleased films, employee social security numbers and sensitive internal documents. North Korea suspected.",Buzzfeed,Culver City,USA,34.0219,-118.4814,"[34.0219, -118.4814]",SSN/Personal details,2014-12-01
340,Sony Pictures,1000000,Jun,2011,web,hacked,1,The LulzSec hacking collective accessed unencrypted user information. They claimed that they didn't have the resources to steal everything they were able to access.,Mashable,Culver City,USA,34.0219,-118.4814,"[34.0219, -118.4814]",Just email address/online information,2011-06-01
249,Indiana University,146000,Feb,2014,academic,poor security,2,Students who attended the university between 2011 and 2014 may have had their data accessed by three automated computer data mining applications.,Indiana University,Bloomington,USA,40.4842,-88.9937,"[40.4842, -88.9937]",SSN/Personal details,2014-02-01
250,Ebay,145000000,May,2014,web,hacked,1,"Hackers attacked between late February and early March, using the login credentials of three corporate employees. They then accessed a database containing all user records.",Business Insider,San Jose,USA,37.3541,-121.9552,"[37.3541, -121.9552]",Just email address/online information,2014-05-01
251,UPS,4000000,Aug,2014,retail,hacked,3,Malware was discovered in the credit & debit card processing systems of 51 UPS branches in 24 states. It was leaking data for as long as eight months.,Time,Atlanta,USA,33.749,-84.388,"[33.749, -84.388]",Credit card information,2014-08-01
252,European Central Bank,4000000,Jul,2014,financial,hacked,1,"The ECB received an anonymous call requesting money in return for the stolen data. The bank didn't say how much the blackmailer asked for, but did say that it refused to pay anything.",City am,Frankfurt,Germany,50.1109,8.6821,"[50.1109, 8.6821]",Just email address/online information,2014-07-01
253,JP Morgan Chase,76000000,Oct,2014,financial,hacked,3,"A hack of the USA's largest bank began in June, but was not discovered until July, when the hackers had already obtained the highest level of administrative privilege for dozens of servers.",Deal Book,New York City,USA,40.7128,-74.006,"[40.7128, -74.006]",Credit card information,2014-10-01
406,JP Morgan Chase,2600000,May,2007,financial,lost device,3,Personal information was mistakenly identified as trash and thrown out in garbage bags outside five branch offices in New York.,PC World,New York City,USA,40.7128,-74.006,"[40.7128, -74.006]",Credit card information,2007-05-01
255,HSBC Turkey,2700000,Nov,2014,financial,hacked,4,"An attack on credit and debit card systems left numbers, account numbers, expiry dates and customer names compromised.",Reuters,Istanbul,Turkey,41.0082,28.9784,"[41.0082, 28.9784]",Health & other personal records,2014-11-01
256,Japan Airlines,750000,Sep,2014,transport,hacked,2,"Japan Airlines confirmed the possible theft of information from up to 750,000 frequent-flier programme members, including names, birth dates, addresses and places of work.","WSJ, Japan Airlines",Tokyo,Japan,35.682839,139.759455,"[35.682839, 139.759455]",SSN/Personal details,2014-09-01
257,Staples,1160000,Dec,2014,retail,hacked,3,"Point of sale systems were infected with malware. Thieves may have used it to steal customer names, payment card numbers, expiration dates and card verification codes.",Fortune,Framingham,USA,42.2793,-71.4162,"[42.2793, -71.4162]",Credit card information,2014-12-01
258,GMail,5000000,Sep,2014,web,hacked,1,Account details and passwords were posted on a Russian Bitcoin forum. Close inspection revealed the user details to be old (3+ years). Gmail itself was not hacked.,The Next Web,Mountain View,USA,37.3861,-122.0839,"[37.3861, -122.0839]",Just email address/online information,2014-09-01
259,Home Depot,56000000,Sep,2014,retail,hacked,3,"Malware installed on cash register systems at 2,200 stores syphoned credit card details of up to 56 million customers, which were then sold online.",Krebs on Security,Atlanta,USA,33.749,-84.388,"[33.749, -84.388]",Credit card information,2014-09-01
260,Korea Credit Bureau,20000000,Jan,2014,financial,inside job,5,An employee was accused of of stealing data from customers of three credit card firms while working as a temporary consultant.,Security Week,Seoul,South Korea,37.5665,126.978,"[37.5665, 126.978]",Full details,2014-01-01
261,Dominios Pizzas (France),600000,Jun,2014,retail,hacked,1,"Hackers demanded a ransom of €30,000 (£24,000) from Domino's Pizza after stealing personal data on more than 600,000 of its French and Belgian customers.",The Guardian,Paris,France,48.8566,2.3522,"[48.8566, 2.3522]",Just email address/online information,2014-06-01
262,Mozilla,76000,Aug,2014,web,poor security,2,"After the failure of a ""data sanitation"" process, Mozilla’s developer community was alerted to an accidental leak of email addresses and encrypted passwords.",The Guardian,Mountain View,USA,37.3861,-122.0839,"[37.3861, -122.0839]",SSN/Personal details,2014-08-01
264,"Affinity Health Plan, Inc.",344579,Aug,2013,health,lost device,4,"A rented photocopier used to copy health records did not have its hard-drive wiped before its return, exposing personal data.",Proskauer,New York City,USA,40.7128,-74.006,"[40.7128, -74.006]",Health & other personal records,2013-08-01
265,Citigroup,150000,Jul,2013,financial,accident,2,The bank failed to redact court records before they were placed on a publicly accessible system. The personal information of customers entering bankruptcy between 2007-2011 was exposed.,Softpedia,New York City,USA,40.7128,-74.006,"[40.7128, -74.006]",SSN/Personal details,2013-07-01
339,Citigroup,210000,Jun,2011,financial,hacked,3,A breach of the bank's online web portal compromised the information of around 1% of Citbank card holders.,PC World,New York City,USA,40.7128,-74.006,"[40.7128, -74.006]",Credit card information,2011-06-01
415,Citigroup,3900000,Jun,2005,financial,lost device,3,A box of computer tapes containing information on 3.9 million customers was lost in transit to a credit reporting agency.,NY Times,New York City,USA,40.7128,-74.006,"[40.7128, -74.006]",Credit card information,2005-06-01
266,Tianya,40000000,Jul,2013,web,hacked,1,China's biggest online forum confirmed that private information for 40 million users had been breached back in 2011.,"Computer World, Hacker News",Hainan,China,19.5664,109.9487,"[19.5664, 109.9487]",Just email address/online information,2013-07-01
267,Scribd,500000,Apr,2013,web,hacked,1,"A website billing itself as the ""world's largest online library"" was hacked. 1% of its users had passwords compromised.","Naked Security, NBC News",San Francisco,USA,37.7749,-122.4194,"[37.7749, -122.4194]",Just email address/online information,2013-04-01
268,Living Social,50000000,Apr,2013,web,hacked,1,"Hackers gained access to  names, e-mail addresses, dates of birth & encrypted passwords for 50 million users of an online offers site part-owned by Amazon.","Naked Security, New York Times",Washington,USA,38.8951,-77.0369,"[38.8951, -77.0369]",Just email address/online information,2013-04-01
270,SnapChat,4600000,Jan,2013,web,hacked,2,"Hackers abused an exploit to siphon off usernames and phone numbers, which were then posted online.",BBC News,Santa Monica,USA,34.0194,-118.4912,"[34.0194, -118.4912]",SSN/Personal details,2013-01-01
271,University of Delaware,74000,Aug,2013,academic,hacked,2,Confidential personal information on past and current employees of the University of Delaware was stolen when a software vulnerability was exploited.,University of Delaware,Newark,USA,40.7357,-74.1724,"[40.7357, -74.1724]",SSN/Personal details,2013-08-01
272,Central Hudson Gas & Electric,110000,Feb,2013,misc,hacked,3,Customer banking information and other personal information may have been accessed when systems belonging to the energy supplier were hacked.,eSecurity Planet,Poughkeepsie,USA,41.7004,-73.921,"[41.7004, -73.921]",Credit card information,2013-02-01
274,"Crescent Health Inc., Walgreens",100000,Feb,2013,health,lost device,4,"A stolen laptop exposed private data including names, social security numbers, health insurance information, birth dates, diagnoses and other medical information.",Healthcare IT News,Deerfield,USA,42.1711,-87.8445,"[42.1711, -87.8445]",Health & other personal records,2013-02-01
275,Florida Department of Juvenile Justice,100000,Jan,2013,government,lost device,2,"The theft of a mobile device containing youth and employment records exposed 100,000 young people to potential identity theft.",Data Breaches,Tallahassee,USA,30.4383,-84.2807,"[30.4383, -84.2807]",SSN/Personal details,2013-01-01
276,Advocate Medical Group,4000000,Aug,2013,health,lost device,2,"Four unencrypted computers were stolen from an office belonging to the healthcare provider. 4,000,000 patient names, addresses, dates of birth and Social Security numbers were exposed.",Health IT Security,Downers Grove,USA,41.8089,-88.0112,"[41.8089, -88.0112]",SSN/Personal details,2013-08-01
277,OVH,200000,Jul,2013,web,hacked,2,"A hacker gained access to an email account, from where they were able to compromise the firm's internal systems. The European customer database was exposed.",OVH,Roubaix,France,50.6942,3.1746,"[50.6942, 3.1746]",SSN/Personal details,2013-07-01
278,Apple,275000,Jul,2013,tech,hacked,1,"Apple's developer portal was hacked. ""Some"" information about 275,000 3rd-party developers was potentially stolen.",The Guardian,Cupertino,USA,37.323,-122.0322,"[37.323, -122.0322]",Just email address/online information,2013-07-01
279,NASDAQ,500000,Jul,2013,financial,hacked,1,"Cybercriminals targeted the Nasdaq online forum, stealing email addresses and passwords.",Reuters,New York City,USA,40.7128,-74.006,"[40.7128, -74.006]",Just email address/online information,2013-07-01
280,UbiSoft,58000000,Jul,2013,gaming,hacked,2,"The video games publisher revealed that user names, email addresses and encrypted passwords had been ""illegally accessed"".",BBC News,Montreuil,France,48.8632,2.4485,"[48.8632, 2.4485]",SSN/Personal details,2013-07-01
281,Ubuntu,2000000,Jul,2013,tech,hacked,3,"The discussion forum for the operating system was hacked, exposing personal details and weakly-hashed passwords.",Ars Technica,London,United Kingdom,51.5074,-0.1278,"[51.5074, -0.1278]",Credit card information,2013-07-01
283,National Security Agency,1500000,Jun,2013,government,inside job,5,"Edward Snowden, an intelligence contractor in Hawaii, downloaded up to 1.5 million files. He then flew to Hong Kong to meet journalists Glenn Greenwald and Laura Poitras before fleeing to Moscow. ",Business Insider,Fort Meade,USA,39.1096,-76.7446,"[39.1096, -76.7446]",Full details,2013-06-01
285,Evernote,50000000,Mar,2013,web,hacked,1,"Evernote asked all its users to reset their passwords, following the discovery of unauthorised access of personal details.","Wired, Digital Trends",Redwood City,USA,37.4852,-122.2364,"[37.4852, -122.2364]",Just email address/online information,2013-03-01
286,Kirkwood Community College,125000,Apr,2013,academic,hacked,2,"Hackers accessed data relating to applications made between February 2006 and March 2013, including names, birth dates, race, contact information and Social Security numbers.",eSecurity Planet,Cedar Rapids,USA,41.9779,-91.6656,"[41.9779, -91.6656]",SSN/Personal details,2013-04-01
287,Yahoo Japan,22000000,May,2013,tech,hacked,1,22 million Yahoo user IDs may have been leaked after Yahoo detected an unauthorized attempt to access the administrative system of its Yahoo Japan portal.,Reuters,Tokyo,Japan,35.682839,139.759455,"[35.682839, 139.759455]",Just email address/online information,2013-05-01
288,Drupal,1000000,May,2013,web,hacked,1,"Malicious files were placed on the servers of the content management platform. They exposed usernames, e-mail addresses and cryptographically hashed passwords.",Ars Technica,Portland,USA,45.5051,-122.675,"[45.5051, -122.675]",Just email address/online information,2013-05-01
289,TerraCom & YourTel,170000,May,2013,telecoms,accident,2,"Journalists discovered the personal data of over 170,000 customers on a publicly accessible server. Hilariously, the firms branded the journalists ""hackers"".","Boing Boing, Wired",Oklahoma City,USA,35.4634,-97.5151,"[35.4634, -97.5151]",SSN/Personal details,2013-05-01
293,Vodafone,2000000,Sep,2013,telecoms,inside job,3,"An IT contractor for the firm used his access to the telecom giant's system to steal customer details, including bank account numbers and sort codes.",Security Week,Newbury,United Kingdom,51.3989,-1.327,"[51.3989, -1.327]",Credit card information,2013-09-01
294,Adobe,38000000,Oct,2013,tech,hacked,3,"Hackers obtained access to a swathe of Adobe customer IDs, encrypted passwords & sensitive information including encrypted credit and debit card numbers. Plus source code.",Adobe,San Jose,USA,37.3541,-121.9552,"[37.3541, -121.9552]",Credit card information,2013-10-01
297,Target,70000000,Dec,2013,retail,hacked,3,Investigators believe that personal data was obtained via software installed on card-swiping machines at Target stores.,Huffington Post,Minneapolis,USA,44.9778,-93.265,"[44.9778, -93.265]",Credit card information,2013-12-01
298,China Software Developer Network,6000000,Mar,2012,web,hacked,1,A man surnamed Zeng was arrested on suspicion of leaking personal information belonging to users of the China Software Developer Network (CSDN).,ZDNet,Beijing,China,39.9042,116.4074,"[39.9042, 116.4074]",Just email address/online information,2012-03-01
299,Global Payments,1500000,Apr,2012,financial,hacked,3,"Hackers gained unauthorised access to systems of the payment processing firm, exposing over a million credit card numbers.",Washington Post,Atlanta,USA,33.749,-84.388,"[33.749, -84.388]",Credit card information,2012-04-01
300,South Carolina Government,228000,Apr,2012,health,inside job,4,A man was arrested for sending confidential information on Medicaid beneficiaries to his personal email address.,The State,Columbia,USA,34.0007,-81.0348,"[34.0007, -81.0348]",Health & other personal records,2012-04-01
